{
  "name": "Yelp Neon",
  "version": "1.0.0",
  "author": "Kari Core",
  "scope": "plugin",
  "layout": "card",
  "style": {
    "colors": {
      "background": "#0a0a0a",
      "text": "#ff0055"
    },
    "typography": {
      "fontFamily": "Arial, sans-serif"
    },
    "icons": {
      "rating": "star"
    }
  },
  "metadata": {
    "plugin": "yelp"
  }
}
